{
  "$schema": "https://json-schema.org/draft/2020-12/schema",
  "title": "CAD-ready summary — Industrial Design Intake handoff",
  "description": "CAD-neutral handoff produced by the Industrial Design Intake process (docs/industrial_intake/). It describes product intent, modules, parameters, constraints, interfaces, manufacturing assumptions, and readiness — never backend-specific CAD calls. Version 1.",
  "type": "object",
  "additionalProperties": false,
  "required": [
    "schema_version",
    "project",
    "units",
    "requirements",
    "parameters",
    "modules",
    "interfaces",
    "cots",
    "manufacturing",
    "cad_strategy",
    "readiness"
  ],
  "properties": {
    "schema_version": { "const": 1 },
    "project": {
      "type": "object",
      "additionalProperties": false,
      "required": ["name", "intent"],
      "properties": {
        "name": { "type": "string", "pattern": "^[a-z0-9_]+$" },
        "intent": { "type": "string", "minLength": 1 }
      }
    },
    "units": {
      "type": "object",
      "additionalProperties": false,
      "required": ["length", "mass", "angle"],
      "properties": {
        "length": { "type": "string" },
        "mass": { "type": "string" },
        "angle": { "type": "string" }
      }
    },
    "requirements": {
      "type": "array",
      "minItems": 1,
      "items": {
        "type": "object",
        "additionalProperties": false,
        "required": ["id", "text", "priority", "verification"],
        "properties": {
          "id": { "type": "string", "pattern": "^REQ-[0-9]{3,}$" },
          "text": { "type": "string", "minLength": 1 },
          "priority": { "enum": ["must", "should", "could"] },
          "verification": {
            "enum": ["inspection", "analysis", "demonstration", "test"]
          }
        }
      }
    },
    "parameters": {
      "type": "array",
      "items": {
        "type": "object",
        "additionalProperties": false,
        "required": ["name", "value", "unit", "status", "rationale"],
        "properties": {
          "name": { "type": "string", "pattern": "^[A-Z][A-Z0-9_]*$" },
          "value": { "type": "number" },
          "unit": { "type": "string" },
          "status": {
            "enum": ["required", "assumed", "measured", "vendor_provided", "derived"]
          },
          "rationale": { "type": "string", "minLength": 1 }
        }
      }
    },
    "modules": {
      "type": "array",
      "minItems": 1,
      "items": {
        "type": "object",
        "additionalProperties": false,
        "required": ["id", "name", "role", "cad_intent", "interfaces", "build_buy"],
        "properties": {
          "id": { "type": "string", "pattern": "^MOD-[0-9]{3,}$" },
          "name": { "type": "string", "pattern": "^[a-z0-9_]+$" },
          "role": { "type": "string", "minLength": 1 },
          "cad_intent": { "enum": ["part", "assembly", "fixture", "purchased"] },
          "interfaces": {
            "type": "array",
            "items": { "type": "string", "pattern": "^IF-[0-9]{3,}$" }
          },
          "build_buy": { "enum": ["build", "buy", "mixed"] }
        }
      }
    },
    "interfaces": {
      "type": "array",
      "items": {
        "type": "object",
        "additionalProperties": false,
        "required": ["id", "from", "to", "type", "description"],
        "properties": {
          "id": { "type": "string", "pattern": "^IF-[0-9]{3,}$" },
          "from": { "type": "string" },
          "to": { "type": "string" },
          "type": { "enum": ["spatial", "mechanical", "electrical", "data", "thermal"] },
          "description": { "type": "string", "minLength": 1 }
        }
      }
    },
    "cots": {
      "type": "array",
      "items": {
        "type": "object",
        "additionalProperties": false,
        "required": [
          "id",
          "category",
          "selection_status",
          "model",
          "critical_dimensions",
          "cad_asset"
        ],
        "properties": {
          "id": { "type": "string", "pattern": "^COTS-[0-9]{3,}$" },
          "category": { "type": "string", "minLength": 1 },
          "selection_status": { "enum": ["candidate", "selected"] },
          "model": { "type": "string", "minLength": 1 },
          "critical_dimensions": {
            "type": "object",
            "additionalProperties": false,
            "patternProperties": {
              "^[a-z0-9_]+$": {
                "type": "object",
                "additionalProperties": false,
                "required": ["value", "unit"],
                "properties": {
                  "value": { "type": "number" },
                  "unit": { "type": "string" }
                }
              }
            }
          },
          "cad_asset": { "enum": ["available", "missing"] }
        }
      }
    },
    "manufacturing": {
      "type": "object",
      "additionalProperties": false,
      "required": ["candidate_processes", "tolerance_policy", "notes"],
      "properties": {
        "candidate_processes": {
          "type": "array",
          "minItems": 1,
          "items": { "type": "string" }
        },
        "tolerance_policy": { "type": "string", "minLength": 1 },
        "notes": { "type": "array", "items": { "type": "string" } }
      }
    },
    "cad_strategy": {
      "type": "object",
      "additionalProperties": false,
      "required": ["coordinate_system", "top_down", "global_variables", "backend_targets"],
      "properties": {
        "coordinate_system": { "type": "string", "minLength": 1 },
        "top_down": { "type": "boolean" },
        "global_variables": {
          "type": "array",
          "items": { "type": "string", "pattern": "^[A-Z][A-Z0-9_]*$" }
        },
        "backend_targets": {
          "type": "array",
          "minItems": 1,
          "items": { "type": "string" }
        }
      }
    },
    "readiness": {
      "type": "object",
      "additionalProperties": false,
      "required": ["state", "blocking_questions", "manual_review_required"],
      "properties": {
        "state": {
          "enum": [
            "idea_only",
            "requirements_draft",
            "architecture_draft",
            "cad_ready_with_assumptions",
            "cad_ready",
            "blocked"
          ]
        },
        "blocking_questions": { "type": "array", "items": { "type": "string" } },
        "manual_review_required": { "type": "array", "items": { "type": "string" } }
      }
    }
  }
}
